{
  "$schema": "../../../tools/schemas/fable2-gpu-static-xdk-seam-coverage-v1.schema.json",
  "schema_version": "1.0.0",
  "corpus": "Fable II Native Renderer G1.6B",
  "phase": "G1.6B - Static Seam Qualification and Coverage",
  "experiment_id": "EXP-STATIC-XDK-002",
  "generated_on": "2026-09-01",
  "primary_result": "STATIC COVERAGE NARROW",
  "pins": {
    "fable_start": {
      "branch": "fable2-native-renderer-g1.6a-static-xdk-recovery",
      "commit": "9af33118bcfbf00f8b446f05e90d18de193410c1",
      "tree": "fd91d6931e81108d4a619d3875c28b4d66e05187"
    },
    "g1_5d_base": { "commit": "78c5d66807abf19f67966bd0c3d8301c29990ae4" },
    "paused_g2a": { "commit": "47c2ea2b7d9e14b09fd942c4b5f1bd11c46e2f51", "incorporated": false },
    "tu1": {
      "loaded_image_sha256": "BF7300F7E0DEEE91444ACD50FBE69752F5CFD3CF51358186F1B849DF25A8CB00",
      "base": "0x82000000",
      "size": "0x01620000",
      "entry_point": "0x82CC21C0"
    },
    "rexglue": {
      "path": "C:/Dev/rexglue-sdk-v0.10",
      "commit": "956c6a8b5da4c54b9899a2593e9c67c26de30194",
      "tree": "b78b06b8ac650467372236a3a262864e069a9382",
      "allowed_preexisting_status": [" m thirdparty/libmspack"]
    },
    "canary": {
      "path": "C:/Dev/Fable2NativeRendererResearch/xenia-canary",
      "commit": "3a44f20c7bc66db1da583e8a6f0ab740e31908e9",
      "tree": "c343b0a5796590fadc3b78c993bfada51e7e9148"
    },
    "active_gpu_plugin": {
      "path": "out/build/win-amd64-release/rexgpu-xenos.dll",
      "sha256": "8232051BED6E5CE99CF37B2EF581C824F58875C140A4D3C75DE14E8A5DF4AA99",
      "size": 2770944,
      "backend": "D3D12_ONLY"
    }
  },
  "starting_state": {
    "required_branch": "fable2-native-renderer-g1.6a-static-xdk-recovery",
    "required_commit": "9af33118bcfbf00f8b446f05e90d18de193410c1",
    "required_tree": "fd91d6931e81108d4a619d3875c28b4d66e05187",
    "working_branch": "fable2-native-renderer-g1.6b-static-seam-coverage",
    "paused_g2a_incorporated": false
  },
  "analysis_inputs": [
    {
      "input_id": "INPUT-G16A-CORPUS",
      "path": "docs/fable2-gpu-reference/",
      "provenance": "Committed G1.6A corpus at tree fd91d6931e81108d4a619d3875c28b4d66e05187.",
      "status": "COMMITTED",
      "purpose": "Accepted SXDK identities, prior phase conclusions, pins, ownership decisions and experiment constraints."
    },
    {
      "input_id": "INPUT-G1-CANDIDATES",
      "path": "docs/fable2-native-renderer/candidate-hook-inventory.json",
      "provenance": "Accepted G1 evidence descended from c44e8c16f4422f9a828caf30899ac989170b8a8c.",
      "status": "COMMITTED",
      "purpose": "Accepted call-cluster boundaries and dispositions."
    },
    {
      "input_id": "INPUT-PROVENANCE",
      "path": "tools/fable2-entrypoint-closure-evidence.json",
      "provenance": "Size 4768; SHA-256 10F9411631AE08D653FB1CDCA192E364CF499BB56948A6E72F93384632786CC7.",
      "status": "COMMITTED",
      "purpose": "Exact XEX/XEXP/loaded-image identity and generation provenance."
    },
    {
      "input_id": "INPUT-CLOSURE",
      "path": "out/analysis/BF7300F7E0DEEE91444ACD50FBE69752F5CFD3CF51358186F1B849DF25A8CB00/entrypoint-closure.json",
      "provenance": "Size 341019731; SHA-256 665CA2AE7ED65632B2E9F368063D3D9EE260E8DEF6F276B455CD62A9F2DCC397.",
      "status": "IGNORED LOCAL READ-ONLY",
      "purpose": "Trusted TU1 ranges, direct edges, indirect sites and address-taken evidence."
    },
    {
      "input_id": "INPUT-GHIDRA",
      "path": "out/analysis/BF7300F7E0DEEE91444ACD50FBE69752F5CFD3CF51358186F1B849DF25A8CB00/ghidra-function-map.json",
      "provenance": "Size 96710692; SHA-256 03516B3A1F33433E493739418C9939D4FF1AEB0989F4ACEF2FD4D8204A077F58.",
      "status": "IGNORED LOCAL READ-ONLY",
      "purpose": "Independent function entries, pdata records and reference cross-checks."
    },
    {
      "input_id": "INPUT-JUMPS",
      "path": "out/analysis/BF7300F7E0DEEE91444ACD50FBE69752F5CFD3CF51358186F1B849DF25A8CB00/jump-table-recovery.json",
      "provenance": "Size 81223154; SHA-256 B1FE26FB9119DAF7E7E0196CBDBA8CCA087BE190BF156FE0B12DF116379ED89A.",
      "status": "IGNORED LOCAL READ-ONLY",
      "purpose": "Recovered indirect targets and bounded unresolved-transfer census."
    },
    {
      "input_id": "INPUT-GENERATED",
      "path": "generated/default/fable2_recomp.*.cpp",
      "provenance": "293 generated translation units from the exact pinned TU1 inputs; 60,425 generated guest functions and 4,497,828 PPC instructions scanned.",
      "status": "IGNORED LOCAL READ-ONLY",
      "purpose": "Whole-generated-corpus packet, constant, call, use-site and address-materialization searches."
    },
    {
      "input_id": "INPUT-REXGLUE",
      "path": "C:/Dev/rexglue-sdk-v0.10/include/rex/graphics/xenos.h; C:/Dev/rexglue-sdk-v0.10/src/graphics/command_processor.cpp",
      "provenance": "Pinned read-only ReXGlue commit 956c6a8b5da4c54b9899a2593e9c67c26de30194.",
      "status": "PINNED READ-ONLY REFERENCE",
      "purpose": "PM4 opcode, SET_CONSTANT selector and fetch-constant consumer semantics."
    },
    {
      "input_id": "INPUT-CANARY",
      "path": "C:/Dev/Fable2NativeRendererResearch/xenia-canary/src/xenia/gpu/",
      "provenance": "Pinned read-only Canary commit 3a44f20c7bc66db1da583e8a6f0ab740e31908e9.",
      "status": "PINNED READ-ONLY REFERENCE",
      "purpose": "Independent packet/register semantics only; never used as proof of Fable II reachability."
    }
  ],
  "coverage_boundaries": {
    "executable_ranges": [
      { "section": ".text", "start": "0x82170000", "end": "0x832BABBC", "size": "0x0114ABBC" },
      { "section": "BINK", "start": "0x832BAC00", "end": "0x832CA03C", "size": "0x0000F43C" }
    ],
    "generated": {
      "files": 293,
      "functions": 60425,
      "instructions": 4497828,
      "union_bytes": 17989684,
      "executable_bytes": 18194424,
      "coverage_percent": 98.8747101859,
      "uncovered_bytes": 204740
    },
    "entrypoint_closure": {
      "function_ranges": 60662,
      "trusted_ranges": 51327,
      "preliminary_ranges": 9335,
      "union_bytes": 18069800,
      "coverage_percent": 99.3150428945,
      "uncovered_bytes": 124624,
      "indirect_sites": 4526,
      "strong_new_functions": 55,
      "probable_new_functions": 180
    },
    "blind_spots": [
      "124,624 executable bytes are outside the closure range union and 204,740 are outside generated-function union.",
      "4,526 accepted-closure indirect sites are not globally resolvable by a direct-call search.",
      "Two recovered PM4 indirect-buffer builders can submit payload content that is not statically decoded by this bounded phase.",
      "Two metadata-driven LOAD_ALU_CONSTANT helpers choose selector type from runtime resource records, so static code cannot prove whether a given record is texture FETCH type 1.",
      "Dynamic code/data mutation and runtime packet frequency are outside a static experiment."
    ]
  },
  "search_strategies": [
    {
      "strategy_id": "SEARCH-DIRECT-XREF",
      "scope": "All 60,425 generated functions plus closure and Ghidra references for 0x82BA77D0.",
      "result": "Exactly two generated direct calls, from 0x82BA7B28 at 0x82BA81CC and 0x82BA83C0 at 0x82BA85D8; no exact-target thunk or data/table reference.",
      "limitation": "An unresolved computed target that never materializes the exact address cannot be identified as a caller."
    },
    {
      "strategy_id": "SEARCH-PACKET-OPCODES",
      "scope": "Whole generated corpus for constructed Type 3 PM4_SET_CONSTANT, LOAD_ALU_CONSTANT, SET_CONSTANT2, SET_SHADER_CONSTANTS, LOAD_CONSTANT_CONTEXT and SET_STATE headers.",
      "result": "One explicit SET_CONSTANT FETCH producer, three dynamic LOAD_ALU helpers, and three SET_STATE record builders; false hits were rejected by header-high and following-store checks.",
      "limitation": "Prebuilt or runtime-loaded packet payloads are opaque."
    },
    {
      "strategy_id": "SEARCH-TYPE0-FETCH",
      "scope": "Whole generated corpus for Type 0 headers covering register range 0x4800..0x48FF, then six-word descriptor type decoding.",
      "result": "Four real header constructors: one texture producer and three vertex-only producers.",
      "limitation": "A header assembled without a recoverable immediate may evade this syntactic search."
    },
    {
      "strategy_id": "SEARCH-DYNAMIC-SELECTORS",
      "scope": "All LOAD_ALU_CONSTANT call sites, selector arithmetic and constant argument pairs.",
      "result": "sub_8227D150 is bounded to ALU type 0 at all ten call sites; sub_82221B90 and sub_8222BFA0 take selector types from runtime metadata and remain texture-capable but unresolved.",
      "limitation": "Resource metadata values are not embedded in code and payload capture is prohibited."
    },
    {
      "strategy_id": "SEARCH-ADDRESS-TAKEN",
      "scope": "Closure candidates, Ghidra references, generated lis/addi materializations, recovered pointer runs and jump-table targets.",
      "result": "No exact address-taken reference to SXDK-001; SXDK-003 is materialized at 0x82BAA338/0x82BAA358 into a callback registration record.",
      "limitation": "The registrar dispatcher is an unresolved virtual call, so invocation thread and record retention are unknown."
    },
    {
      "strategy_id": "SEARCH-DRAW-BYPASS",
      "scope": "Callers of common state producer sub_8221B010 and downstream DRAW_INDX packet construction.",
      "result": "Six accepted-closure state-to-draw segments bypass SXDK-001 and route through metadata-driven sub_8222BFA0.",
      "limitation": "Static names do not identify character, terrain, particles, UI, video, post-processing or shadow membership."
    },
    {
      "strategy_id": "SEARCH-REFERENCE-SEMANTICS",
      "scope": "Pinned ReXGlue and Canary command processors and Xenos register definitions.",